
==================================== ERRORS ====================================
___________ ERROR collecting tests/strands/models/test_anthropic.py ____________
ImportError while importing test module '/home/runner/work/sdk-python/sdk-python/tests/strands/models/test_anthropic.py'.
Hint: make sure your test modules/packages have valid Python names.
Traceback:
/opt/hostedtoolcache/Python/3.13.11/x64/lib/python3.13/importlib/__init__.py:88: in import_module
    return _bootstrap._gcd_import(name[level:], package, level)
           ^^^^^^^^^^^^^^^^^^^^^^^^^^^^^^^^^^^^^^^^^^^^^^^^^^^^
tests/strands/models/test_anthropic.py:3: in <module>
    import anthropic
E   ModuleNotFoundError: No module named 'anthropic'
_____________ ERROR collecting tests/strands/models/test_gemini.py _____________
ImportError while importing test module '/home/runner/work/sdk-python/sdk-python/tests/strands/models/test_gemini.py'.
Hint: make sure your test modules/packages have valid Python names.
Traceback:
/opt/hostedtoolcache/Python/3.13.11/x64/lib/python3.13/importlib/__init__.py:88: in import_module
    return _bootstrap._gcd_import(name[level:], package, level)
           ^^^^^^^^^^^^^^^^^^^^^^^^^^^^^^^^^^^^^^^^^^^^^^^^^^^^
tests/strands/models/test_gemini.py:7: in <module>
    from google import genai
E   ModuleNotFoundError: No module named 'google'
____________ ERROR collecting tests/strands/models/test_litellm.py _____________
ImportError while importing test module '/home/runner/work/sdk-python/sdk-python/tests/strands/models/test_litellm.py'.
Hint: make sure your test modules/packages have valid Python names.
Traceback:
/opt/hostedtoolcache/Python/3.13.11/x64/lib/python3.13/importlib/__init__.py:88: in import_module
    return _bootstrap._gcd_import(name[level:], package, level)
           ^^^^^^^^^^^^^^^^^^^^^^^^^^^^^^^^^^^^^^^^^^^^^^^^^^^^
tests/strands/models/test_litellm.py:6: in <module>
    from litellm.exceptions import ContextWindowExceededError
E   ModuleNotFoundError: No module named 'litellm'
____________ ERROR collecting tests/strands/models/test_llamaapi.py ____________
ImportError while importing test module '/home/runner/work/sdk-python/sdk-python/tests/strands/models/test_llamaapi.py'.
Hint: make sure your test modules/packages have valid Python names.
Traceback:
/opt/hostedtoolcache/Python/3.13.11/x64/lib/python3.13/importlib/__init__.py:88: in import_module
    return _bootstrap._gcd_import(name[level:], package, level)
           ^^^^^^^^^^^^^^^^^^^^^^^^^^^^^^^^^^^^^^^^^^^^^^^^^^^^
tests/strands/models/test_llamaapi.py:7: in <module>
    from strands.models.llamaapi import LlamaAPIModel
src/strands/models/llamaapi.py:13: in <module>
    import llama_api_client
E   ModuleNotFoundError: No module named 'llama_api_client'
____________ ERROR collecting tests/strands/models/test_mistral.py _____________
ImportError while importing test module '/home/runner/work/sdk-python/sdk-python/tests/strands/models/test_mistral.py'.
Hint: make sure your test modules/packages have valid Python names.
Traceback:
/opt/hostedtoolcache/Python/3.13.11/x64/lib/python3.13/importlib/__init__.py:88: in import_module
    return _bootstrap._gcd_import(name[level:], package, level)
           ^^^^^^^^^^^^^^^^^^^^^^^^^^^^^^^^^^^^^^^^^^^^^^^^^^^^
tests/strands/models/test_mistral.py:7: in <module>
    from strands.models.mistral import MistralModel
src/strands/models/mistral.py:11: in <module>
    import mistralai
E   ModuleNotFoundError: No module named 'mistralai'
_____________ ERROR collecting tests/strands/models/test_ollama.py _____________
ImportError while importing test module '/home/runner/work/sdk-python/sdk-python/tests/strands/models/test_ollama.py'.
Hint: make sure your test modules/packages have valid Python names.
Traceback:
/opt/hostedtoolcache/Python/3.13.11/x64/lib/python3.13/importlib/__init__.py:88: in import_module
    return _bootstrap._gcd_import(name[level:], package, level)
           ^^^^^^^^^^^^^^^^^^^^^^^^^^^^^^^^^^^^^^^^^^^^^^^^^^^^
tests/strands/models/test_ollama.py:8: in <module>
    from strands.models.ollama import OllamaModel
src/strands/models/ollama.py:10: in <module>
    import ollama
E   ModuleNotFoundError: No module named 'ollama'
_____________ ERROR collecting tests/strands/models/test_openai.py _____________
ImportError while importing test module '/home/runner/work/sdk-python/sdk-python/tests/strands/models/test_openai.py'.
Hint: make sure your test modules/packages have valid Python names.
Traceback:
/opt/hostedtoolcache/Python/3.13.11/x64/lib/python3.13/importlib/__init__.py:88: in import_module
    return _bootstrap._gcd_import(name[level:], package, level)
           ^^^^^^^^^^^^^^^^^^^^^^^^^^^^^^^^^^^^^^^^^^^^^^^^^^^^
tests/strands/models/test_openai.py:3: in <module>
    import openai
E   ModuleNotFoundError: No module named 'openai'
___________ ERROR collecting tests/strands/models/test_sagemaker.py ____________
ImportError while importing test module '/home/runner/work/sdk-python/sdk-python/tests/strands/models/test_sagemaker.py'.
Hint: make sure your test modules/packages have valid Python names.
Traceback:
/opt/hostedtoolcache/Python/3.13.11/x64/lib/python3.13/importlib/__init__.py:88: in import_module
    return _bootstrap._gcd_import(name[level:], package, level)
           ^^^^^^^^^^^^^^^^^^^^^^^^^^^^^^^^^^^^^^^^^^^^^^^^^^^^
tests/strands/models/test_sagemaker.py:11: in <module>
    from strands.models.sagemaker import (
src/strands/models/sagemaker.py:11: in <module>
    from mypy_boto3_sagemaker_runtime import SageMakerRuntimeClient
E   ModuleNotFoundError: No module named 'mypy_boto3_sagemaker_runtime'
_____________ ERROR collecting tests/strands/models/test_writer.py _____________
ImportError while importing test module '/home/runner/work/sdk-python/sdk-python/tests/strands/models/test_writer.py'.
Hint: make sure your test modules/packages have valid Python names.
Traceback:
/opt/hostedtoolcache/Python/3.13.11/x64/lib/python3.13/importlib/__init__.py:88: in import_module
    return _bootstrap._gcd_import(name[level:], package, level)
           ^^^^^^^^^^^^^^^^^^^^^^^^^^^^^^^^^^^^^^^^^^^^^^^^^^^^
tests/strands/models/test_writer.py:7: in <module>
    from strands.models.writer import WriterModel
src/strands/models/writer.py:12: in <module>
    import writerai
E   ModuleNotFoundError: No module named 'writerai'
________________ ERROR collecting tests/strands/multiagent/a2a _________________
/opt/hostedtoolcache/Python/3.13.11/x64/lib/python3.13/importlib/__init__.py:88: in import_module
    return _bootstrap._gcd_import(name[level:], package, level)
           ^^^^^^^^^^^^^^^^^^^^^^^^^^^^^^^^^^^^^^^^^^^^^^^^^^^^
<frozen importlib._bootstrap>:1387: in _gcd_import
    ???
<frozen importlib._bootstrap>:1360: in _find_and_load
    ???
<frozen importlib._bootstrap>:1331: in _find_and_load_unlocked
    ???
<frozen importlib._bootstrap>:935: in _load_unlocked
    ???
/opt/hostedtoolcache/Python/3.13.11/x64/lib/python3.13/site-packages/_pytest/assertion/rewrite.py:186: in exec_module
    exec(co, module.__dict__)
tests/strands/multiagent/a2a/conftest.py:6: in <module>
    from a2a.server.agent_execution import RequestContext
E   ModuleNotFoundError: No module named 'a2a'
=============================== warnings summary ===============================
src/strands/experimental/hooks/__init__.py:23
src/strands/experimental/hooks/__init__.py:23
  /home/runner/work/sdk-python/sdk-python/src/strands/experimental/hooks/__init__.py:23: DeprecationWarning: AfterModelInvocationEvent has been moved to production with an updated name. Use AfterModelCallEvent from strands.hooks instead.
    return getattr(events, name)

src/strands/experimental/hooks/__init__.py:23
src/strands/experimental/hooks/__init__.py:23
  /home/runner/work/sdk-python/sdk-python/src/strands/experimental/hooks/__init__.py:23: DeprecationWarning: AfterToolInvocationEvent has been moved to production with an updated name. Use AfterToolCallEvent from strands.hooks instead.
    return getattr(events, name)

src/strands/experimental/hooks/__init__.py:23
src/strands/experimental/hooks/__init__.py:23
  /home/runner/work/sdk-python/sdk-python/src/strands/experimental/hooks/__init__.py:23: DeprecationWarning: BeforeModelInvocationEvent has been moved to production with an updated name. Use BeforeModelCallEvent from strands.hooks instead.
    return getattr(events, name)

src/strands/experimental/hooks/__init__.py:23
src/strands/experimental/hooks/__init__.py:23
  /home/runner/work/sdk-python/sdk-python/src/strands/experimental/hooks/__init__.py:23: DeprecationWarning: BeforeToolInvocationEvent has been moved to production with an updated name. Use BeforeToolCallEvent from strands.hooks instead.
    return getattr(events, name)

tests/strands/experimental/steering/core/test_handler.py:14
  /home/runner/work/sdk-python/sdk-python/tests/strands/experimental/steering/core/test_handler.py:14: PytestCollectionWarning: cannot collect test class 'TestSteeringHandler' because it has a __init__ constructor (from: tests/strands/experimental/steering/core/test_handler.py)
    class TestSteeringHandler(SteeringHandler):

tests/strands/experimental/steering/core/test_handler.py:196
  /home/runner/work/sdk-python/sdk-python/tests/strands/experimental/steering/core/test_handler.py:196: PytestCollectionWarning: cannot collect test class 'TestSteeringHandlerWithProvider' because it has a __init__ constructor (from: tests/strands/experimental/steering/core/test_handler.py)
    class TestSteeringHandlerWithProvider(SteeringHandler):

-- Docs: https://docs.pytest.org/en/stable/how-to/capture-warnings.html
=========================== short test summary info ============================
ERROR tests/strands/models/test_anthropic.py
ERROR tests/strands/models/test_gemini.py
ERROR tests/strands/models/test_litellm.py
ERROR tests/strands/models/test_llamaapi.py
ERROR tests/strands/models/test_mistral.py
ERROR tests/strands/models/test_ollama.py
ERROR tests/strands/models/test_openai.py
ERROR tests/strands/models/test_sagemaker.py
ERROR tests/strands/models/test_writer.py
ERROR tests/strands/multiagent/a2a - ModuleNotFoundError: No module named 'a2a'
!!!!!!!!!!!!!!!!!!! Interrupted: 10 errors during collection !!!!!!!!!!!!!!!!!!!
10 warnings, 10 errors in 3.61s
